{
  "$schema": "https://json-schema.org/draft/2020-12/schema",
  "$id": "genshin-version-transition-behavior-shard-11-snapshot.schema.json",
  "title": "Genshin version transition behavior shard 11 snapshot",
  "type": "object",
  "additionalProperties": false,
  "required": ["schemaVersion", "kind", "generatedAt", "claim", "summary", "gateEligibility", "fieldDigestAlgorithm", "fieldDigest"],
  "properties": {
    "schemaVersion": { "const": 1 },
    "kind": { "const": "genshinVersionTransitionBehaviorShardSnapshot" },
    "generatedAt": { "type": "string", "format": "date-time" },
    "claim": { "$ref": "#/$defs/claim" },
    "summary": { "$ref": "#/$defs/summary" },
    "gateEligibility": { "$ref": "#/$defs/gateEligibility" },
    "fieldDigestAlgorithm": { "const": "sha256-stable-json-v1" },
    "fieldDigest": { "$ref": "#/$defs/sha256" }
  },
  "$defs": {
    "sha256": { "type": "string", "pattern": "^[a-f0-9]{64}$" },
    "revision": { "type": "string", "pattern": "^[a-f0-9]{40}$" },
    "gitBlob": { "type": "string", "pattern": "^[a-f0-9]{40}$" },
    "artifact": {
      "type": "object",
      "additionalProperties": false,
      "required": ["gameVersion", "revision", "packageVersion", "path", "url", "gitBlob", "rawArtifactBytes", "rawArtifactSha256", "embeddedIdPath", "embeddedId", "embeddedName"],
      "properties": {
        "gameVersion": { "enum": ["6.7", "7.0"] },
        "revision": { "$ref": "#/$defs/revision" },
        "packageVersion": { "type": "string", "minLength": 1 },
        "path": { "type": "string", "minLength": 1 },
        "url": { "type": "string", "format": "uri" },
        "gitBlob": { "$ref": "#/$defs/gitBlob" },
        "rawArtifactBytes": { "type": "integer", "minimum": 1 },
        "rawArtifactSha256": { "$ref": "#/$defs/sha256" },
        "embeddedIdPath": { "const": "$.id" },
        "embeddedId": { "type": "integer", "minimum": 1 },
        "embeddedName": { "type": "string", "minLength": 1 }
      }
    },
    "package": {
      "type": "object",
      "additionalProperties": false,
      "required": ["gameVersion", "revision", "packageVersion", "path", "url", "gitBlob", "rawArtifactBytes", "rawArtifactSha256", "name", "description"],
      "properties": {
        "gameVersion": { "enum": ["6.7", "7.0"] },
        "revision": { "$ref": "#/$defs/revision" },
        "packageVersion": { "type": "string", "minLength": 1 },
        "path": { "type": "string", "minLength": 1 },
        "url": { "type": "string", "format": "uri" },
        "gitBlob": { "$ref": "#/$defs/gitBlob" },
        "rawArtifactBytes": { "type": "integer", "minimum": 1 },
        "rawArtifactSha256": { "$ref": "#/$defs/sha256" },
        "name": { "const": "genshin-db" },
        "description": { "type": "string", "minLength": 1 }
      }
    },
    "fieldDiff": {
      "type": "object",
      "additionalProperties": false,
      "required": ["jsonPointer", "beforeValue", "afterValue", "beforeFieldDigest", "afterFieldDigest"],
      "properties": {
        "jsonPointer": { "type": "string", "minLength": 1 },
        "beforeValue": {},
        "afterValue": {},
        "beforeFieldDigest": { "$ref": "#/$defs/sha256" },
        "afterFieldDigest": { "$ref": "#/$defs/sha256" }
      }
    },
    "comparison": {
      "type": "object",
      "additionalProperties": false,
      "required": ["status", "changedFieldCount", "fieldDiffs", "comparisonEligible", "beforeFieldDigest", "afterFieldDigest", "beforeArtifactSha256", "afterArtifactSha256"],
      "properties": {
        "status": { "enum": ["rawRecordMatch", "rawRecordChanged"] },
        "changedFieldCount": { "type": "integer", "minimum": 0 },
        "fieldDiffs": { "type": "array", "items": { "$ref": "#/$defs/fieldDiff" } },
        "comparisonEligible": { "const": true },
        "beforeFieldDigest": { "$ref": "#/$defs/sha256" },
        "afterFieldDigest": { "$ref": "#/$defs/sha256" },
        "beforeArtifactSha256": { "$ref": "#/$defs/sha256" },
        "afterArtifactSha256": { "$ref": "#/$defs/sha256" }
      }
    },
    "record": {
      "type": "object",
      "additionalProperties": false,
      "required": ["recordKind", "before", "after", "comparison"],
      "properties": {
        "recordKind": { "enum": ["talents", "constellations"] },
        "before": { "$ref": "#/$defs/artifact" },
        "after": { "$ref": "#/$defs/artifact" },
        "comparison": { "$ref": "#/$defs/comparison" }
      }
    },
    "identityResolution": {
      "type": "object",
      "additionalProperties": false,
      "required": ["status", "localIdentityEvidenceDigest", "providerNameMatches", "providerEmbeddedIdMatches"],
      "properties": {
        "status": { "const": "resolvedByLocalCatalogAndProviderName" },
        "localIdentityEvidenceDigest": { "$ref": "#/$defs/sha256" },
        "providerNameMatches": { "const": true },
        "providerEmbeddedIdMatches": { "const": true }
      }
    },
    "entity": {
      "type": "object",
      "additionalProperties": false,
      "required": ["entityId", "name", "nameJa", "providerSlug", "providerId", "resolutionStatus", "identityResolution", "treeResolution", "records"],
      "properties": {
        "entityId": { "type": "string", "pattern": "^100000[0-9]{2}$" },
        "name": { "type": "string", "minLength": 1 },
        "nameJa": { "type": "string", "minLength": 1 },
        "providerSlug": { "type": "string", "minLength": 1 },
        "providerId": { "type": "integer", "minimum": 1 },
        "resolutionStatus": { "const": "resolvedUnambiguous" },
        "identityResolution": { "$ref": "#/$defs/identityResolution" },
        "treeResolution": {
          "type": "object",
          "additionalProperties": false,
          "required": ["method", "resolutionEvidence", "directoryPaths", "pathResolution"],
          "properties": {
            "method": { "const": "nonRecursiveGitTreePath" },
            "resolutionEvidence": { "const": "immutableRawPathWithEmbeddedId" },
            "directoryPaths": { "const": ["src/data/English/talents", "src/data/English/constellations"] },
            "pathResolution": { "type": "array", "minItems": 2, "maxItems": 2 }
          }
        },
        "records": { "type": "array", "minItems": 2, "maxItems": 2, "items": { "$ref": "#/$defs/record" } }
      }
    },
    "localIdentity": {
      "type": "object",
      "additionalProperties": false,
      "required": ["authority", "paths", "fileDigests", "entities", "swappedProviderIdEvidence"],
      "properties": {
        "authority": { "const": "data-v2-manifest:characters-catalog-and-source-text" },
        "paths": { "type": "object", "required": ["catalog", "talents", "constellations"] },
        "fileDigests": { "type": "object" },
        "entities": { "type": "array", "minItems": 8, "maxItems": 8 },
        "swappedProviderIdEvidence": { "type": "array", "const": [] }
      }
    },
    "shard": {
      "type": "object",
      "additionalProperties": false,
      "required": ["shardId", "queuePath", "authoritativeCandidateCount", "authoritativeCandidateIds", "authoritativeCandidateIdsDigest", "authoritativeEntityCount", "authoritativeEntityIds", "authoritativeEntityIdsDigest", "capturedNewEntityIds", "skippedOverlapEntityIds", "overlapPolicy", "overlapEvidence"],
      "properties": {
        "shardId": { "const": "behavior:behaviorSpec:semanticDecisionRequired:standard:11" },
        "queuePath": { "type": "string", "minLength": 1 },
        "authoritativeCandidateCount": { "const": 100 },
        "authoritativeCandidateIds": { "type": "array", "minItems": 100, "maxItems": 100, "uniqueItems": true, "items": { "type": "string" } },
        "authoritativeCandidateIdsDigest": { "$ref": "#/$defs/sha256" },
        "authoritativeEntityCount": { "const": 9 },
        "authoritativeEntityIds": { "const": ["10000093", "10000094", "10000095", "10000096", "10000097", "10000098", "10000099", "10000100", "10000101"] },
        "authoritativeEntityIdsDigest": { "$ref": "#/$defs/sha256" },
        "capturedNewEntityIds": { "const": ["10000094", "10000095", "10000096", "10000097", "10000098", "10000099", "10000100", "10000101"] },
        "skippedOverlapEntityIds": { "const": ["10000093"] },
        "overlapPolicy": { "const": "alreadyCapturedByBehaviorShard10" },
        "overlapEvidence": { "type": "array", "minItems": 1, "items": { "type": "object", "additionalProperties": false, "required": ["entityId", "previousShardId", "acquisitionPolicy"], "properties": { "entityId": { "const": "10000093" }, "previousShardId": { "const": "behavior:behaviorSpec:semanticDecisionRequired:standard:10" }, "acquisitionPolicy": { "const": "notReacquired" } } } }
      }
    },
    "claim": {
      "type": "object",
      "additionalProperties": false,
      "required": ["transitionId", "fromGameVersion", "toGameVersion", "provider", "sourceFamily", "sourceNamespace", "repository", "treeResolution", "identityResolution", "shard", "versionBindings", "resolvedEntities", "travelerVariantEvidence", "variantAmbiguities", "travelerVariantPolicy", "coverage"],
      "properties": {
        "transitionId": { "const": "genshin:6.7->7.0" },
        "fromGameVersion": { "const": "6.7" },
        "toGameVersion": { "const": "7.0" },
        "provider": { "const": "genshin-db" },
        "sourceFamily": { "const": "GenshinData-derived" },
        "sourceNamespace": { "const": "genshin-db-behavior-shard11" },
        "repository": { "const": "theBowja/genshin-db" },
        "treeResolution": { "type": "object", "required": ["method", "resolutionEvidence", "note"] },
        "identityResolution": { "$ref": "#/$defs/localIdentity" },
        "shard": { "$ref": "#/$defs/shard" },
        "versionBindings": { "type": "array", "minItems": 2, "maxItems": 2 },
        "resolvedEntities": { "type": "array", "minItems": 8, "maxItems": 8, "items": { "$ref": "#/$defs/entity" } },
        "travelerVariantEvidence": { "const": [] },
        "variantAmbiguities": { "const": [] },
        "travelerVariantPolicy": { "type": "object", "required": ["status", "failClosedOnEncounter", "entityIds", "note"] },
        "coverage": { "type": "object", "required": ["resolvedEntityIds", "ambiguousEntityIds", "recordKinds", "authoritativeCandidateCoverage", "resolvedEntityRecordCoverage", "travelerVariantRecordCoverage", "repositoryCandidateCoverage", "authoritativeCandidateCount", "authoritativeEntityCount", "resolvedEntityCount", "resolvedRecordCount", "changedRecordCount", "changedFieldCount", "overlapEntityCount", "crossVariantComparisons", "canIssueEligibilityCertificate", "canPromoteCanonical"] }
      }
    },
    "summary": {
      "type": "object",
      "additionalProperties": false,
      "required": ["shardId", "authoritativeCandidates", "authoritativeEntities", "resolvedEntities", "overlapSkippedEntities", "ambiguousEntities", "resolvedRecords", "changedRecords", "changedFields", "sourceFamilyCount", "certificateEligibleClaims"],
      "properties": {
        "shardId": { "const": "behavior:behaviorSpec:semanticDecisionRequired:standard:11" },
        "authoritativeCandidates": { "const": 100 },
        "authoritativeEntities": { "const": 9 },
        "resolvedEntities": { "const": 8 },
        "overlapSkippedEntities": { "const": 1 },
        "ambiguousEntities": { "const": 0 },
        "resolvedRecords": { "const": 16 },
        "changedRecords": { "type": "integer", "minimum": 0 },
        "changedFields": { "type": "integer", "minimum": 0 },
        "sourceFamilyCount": { "const": 1 },
        "certificateEligibleClaims": { "const": 0 }
      }
    },
    "gateEligibility": {
      "type": "object",
      "additionalProperties": false,
      "required": ["status", "sourceFamilyCount", "canIssueEligibilityCertificate", "canPromoteCanonical", "reasons"],
      "properties": {
        "status": { "const": "singleCorrelatedFamilyFailClosed" },
        "sourceFamilyCount": { "const": 1 },
        "canIssueEligibilityCertificate": { "const": false },
        "canPromoteCanonical": { "const": false },
        "reasons": { "type": "array", "minItems": 1 }
      }
    }
  }
}
