{
  "schemaVersion": 1,
  "kind": "genshinVersionTransitionBehaviorShardSnapshot",
  "generatedAt": "2026-08-26T00:00:00.000Z",
  "claim": {
    "transitionId": "genshin:6.7->7.0",
    "fromGameVersion": "6.7",
    "toGameVersion": "7.0",
    "provider": "genshin-db",
    "sourceFamily": "GenshinData-derived",
    "sourceNamespace": "genshin-db-behavior-shard11",
    "repository": "theBowja/genshin-db",
    "treeResolution": {
      "method": "nonRecursiveGitTreePath",
      "resolutionEvidence": "immutableRawPathWithEmbeddedId",
      "note": "Every concrete path is accepted only when both pinned revisions contain the expected provider name and explicit $.id."
    },
    "identityResolution": {
      "authority": "data-v2-manifest:characters-catalog-and-source-text",
      "paths": {
        "catalog": "games/genshin/data/characters.json",
        "talents": "games/genshin/data/character-talents.json",
        "constellations": "games/genshin/data/character-constellations.json"
      },
      "fileDigests": {
        "catalog": {
          "sha256": "5d239863352fc896931c0c626e2de1ad60c615e4e376142daa8e2d3a7464c211",
          "rawArtifactBytes": 13747,
          "gitBlob": "36934a8a10b0962e5fac57bb2d36f3b424112fbf"
        },
        "talents": {
          "sha256": "4263297365929e19b3ac99f9e63158d5033d66cf2b37617bdbccb2d8fb8a5e31",
          "rawArtifactBytes": 406867,
          "gitBlob": "e8394c171f51c4295a1d27816ca83991f46650bd"
        },
        "constellations": {
          "sha256": "597d3eb254ccc9cc2fec3d3e7c9bf87fd2bdcca60e2140ffcf08778fd9a91e4e",
          "rawArtifactBytes": 219772,
          "gitBlob": "fcb8abf9bfe635901c7a5e25d160b1721ee605de"
        }
      },
      "entities": [
        {
          "entityId": "10000094",
          "nameJa": "千織",
          "catalogNameJa": "千織",
          "catalogDigest": "5b53bb053d924ef7d3a69c3525416b88c0d9898738ba8a31c694dff870718303",
          "talentSourceDigest": "c9a71f7e1345cff4f04aa097e562f3349f2336f9618eba958c9d39bad6be09fb",
          "constellationSourceDigest": "aa8f25e157a53c8ad7ae8db95b4b698fb11744c761c3ade770d66f2bc877ff6b",
          "identityStatus": "localCatalogAndSourceTextMatch"
        },
        {
          "entityId": "10000095",
          "nameJa": "シグウィン",
          "catalogNameJa": "シグウィン",
          "catalogDigest": "34921c0dedb395395a06f2b721b7fdcbcf059d7f1031569830ccd16c01339e3f",
          "talentSourceDigest": "335fc712d248a976abb4ece2ce5c2b5d2439679bc60e6d657d599536bcd874b5",
          "constellationSourceDigest": "60c95111b7db94015405a1e321ef255f609aede6e8ae3a037455d2d291947902",
          "identityStatus": "localCatalogAndSourceTextMatch"
        },
        {
          "entityId": "10000096",
          "nameJa": "アルレッキーノ",
          "catalogNameJa": "アルレッキーノ",
          "catalogDigest": "ba92e487be8c34974a90fce2fd425639cc87ec4a3b7e44a0266762c1d84bf507",
          "talentSourceDigest": "7770c4296edff749ecbb830fa5e65252d2eda6597ac5a691838ae286851ae366",
          "constellationSourceDigest": "c5f0c34e49cac44703109146e3ff7cd7e44a60584a7bfa2abf30820f39b4e6ba",
          "identityStatus": "localCatalogAndSourceTextMatch"
        },
        {
          "entityId": "10000097",
          "nameJa": "セトス",
          "catalogNameJa": "セトス",
          "catalogDigest": "695ad6315ef647197a369c48355ad10c821684b9efb0ee75d425b25e5927f2b9",
          "talentSourceDigest": "17a1455e3cd9831e00f767406099b255f4519af1229c1fea843013c62707914a",
          "constellationSourceDigest": "b7d08aa406e2e9e6a034fc63cafb09d1e560c078c7fefd5258f5c7ab67a78e08",
          "identityStatus": "localCatalogAndSourceTextMatch"
        },
        {
          "entityId": "10000098",
          "nameJa": "クロリンデ",
          "catalogNameJa": "クロリンデ",
          "catalogDigest": "c37a254c1ea539b62079322c5300309a9605f0bbf3ba4e3f1776943a0bb29c8d",
          "talentSourceDigest": "beedb84fd147b30c29928af93a86c36c7819384ffed22d6cdf1b79743db6f73d",
          "constellationSourceDigest": "bce9f96750798df0bd77abb40afddd75f43900e63215bce531842069cf4674a8",
          "identityStatus": "localCatalogAndSourceTextMatch"
        },
        {
          "entityId": "10000099",
          "nameJa": "エミリエ",
          "catalogNameJa": "エミリエ",
          "catalogDigest": "66f42f62570c611752f9fb8188c9f466d8487e812fe4a039243b32c1822d056d",
          "talentSourceDigest": "04200ed8896f8cdfbcfd186761bfb1e1c7059dcc9c5f64741a3aacc6493eef00",
          "constellationSourceDigest": "d398e4a0200ff73237d970069c793374035e51048c959f0a774903577d0567fb",
          "identityStatus": "localCatalogAndSourceTextMatch"
        },
        {
          "entityId": "10000100",
          "nameJa": "カチーナ",
          "catalogNameJa": "カチーナ",
          "catalogDigest": "e8fefb417592aa5b2dc5af454de38ef3a1aadcda3edd3f92d9ec24006637ff5b",
          "talentSourceDigest": "a675cfb17d4bdef788715ab00edf70c7fe7f81c5fa3bebc9cbd8c07497f6c38b",
          "constellationSourceDigest": "ca9fda21023148bdfa6c6f38c6c546aba2d4e4aa34f821112a535a383fbf1f9b",
          "identityStatus": "localCatalogAndSourceTextMatch"
        },
        {
          "entityId": "10000101",
          "nameJa": "キィニチ",
          "catalogNameJa": "キィニチ",
          "catalogDigest": "7f794ef178aa2f43a4e9c5ef562619b69a3ce085faa4f3205a6fdc31b5a2bac5",
          "talentSourceDigest": "5c0670e814cde1a3cc2d17b4d2698f0374efcb1721a3d8557fbf52c2675de194",
          "constellationSourceDigest": "6508c3582916e79686bfe238fb5127e4a1207235b56099bd2816bd44fb4f458b",
          "identityStatus": "localCatalogAndSourceTextMatch"
        }
      ],
      "swappedProviderIdEvidence": []
    },
    "shard": {
      "shardId": "behavior:behaviorSpec:semanticDecisionRequired:standard:11",
      "queuePath": "reports/genshin-evidence-task-queue.json",
      "authoritativeCandidateCount": 100,
      "authoritativeCandidateIds": [
        "behavior:10000093:constellation:constellation-3",
        "behavior:10000093:constellation:constellation-4",
        "behavior:10000093:constellation:constellation-5",
        "behavior:10000093:constellation:constellation-6",
        "behavior:10000093:talent:burst",
        "behavior:10000093:talent:normalattack-charged",
        "behavior:10000093:talent:normalattack-normal",
        "behavior:10000093:talent:normalattack-plunging",
        "behavior:10000093:talent:passives-passive-1",
        "behavior:10000093:talent:passives-passive-2",
        "behavior:10000093:talent:passives-passive-utility",
        "behavior:10000093:talent:skill",
        "behavior:10000094:constellation:constellation-1",
        "behavior:10000094:constellation:constellation-2",
        "behavior:10000094:constellation:constellation-4",
        "behavior:10000094:constellation:constellation-6",
        "behavior:10000094:talent:normalattack-charged",
        "behavior:10000094:talent:normalattack-normal",
        "behavior:10000094:talent:passives-passive-1",
        "behavior:10000094:talent:passives-passive-2",
        "behavior:10000094:talent:passives-passive-utility",
        "behavior:10000094:talent:skill",
        "behavior:10000095:constellation:constellation-1",
        "behavior:10000095:constellation:constellation-2",
        "behavior:10000095:constellation:constellation-3",
        "behavior:10000095:constellation:constellation-4",
        "behavior:10000095:constellation:constellation-5",
        "behavior:10000095:constellation:constellation-6",
        "behavior:10000095:talent:burst",
        "behavior:10000095:talent:normalattack-charged",
        "behavior:10000095:talent:normalattack-normal",
        "behavior:10000095:talent:normalattack-plunging",
        "behavior:10000095:talent:passives-passive-1",
        "behavior:10000095:talent:passives-passive-2",
        "behavior:10000095:talent:passives-passive-utility",
        "behavior:10000095:talent:skill",
        "behavior:10000096:constellation:constellation-1",
        "behavior:10000096:constellation:constellation-2",
        "behavior:10000096:constellation:constellation-3",
        "behavior:10000096:constellation:constellation-4",
        "behavior:10000096:constellation:constellation-5",
        "behavior:10000096:constellation:constellation-6",
        "behavior:10000096:talent:burst",
        "behavior:10000096:talent:normalattack-charged",
        "behavior:10000096:talent:normalattack-normal",
        "behavior:10000096:talent:normalattack-plunging",
        "behavior:10000096:talent:passives-passive-1",
        "behavior:10000096:talent:passives-passive-2",
        "behavior:10000096:talent:passives-passive-utility",
        "behavior:10000096:talent:skill",
        "behavior:10000097:constellation:constellation-1",
        "behavior:10000097:constellation:constellation-2",
        "behavior:10000097:constellation:constellation-3",
        "behavior:10000097:constellation:constellation-4",
        "behavior:10000097:constellation:constellation-5",
        "behavior:10000097:constellation:constellation-6",
        "behavior:10000097:talent:burst",
        "behavior:10000097:talent:normalattack-charged",
        "behavior:10000097:talent:normalattack-normal",
        "behavior:10000097:talent:normalattack-plunging",
        "behavior:10000097:talent:passives-passive-1",
        "behavior:10000097:talent:passives-passive-2",
        "behavior:10000097:talent:passives-passive-utility",
        "behavior:10000097:talent:skill",
        "behavior:10000098:constellation:constellation-1",
        "behavior:10000098:constellation:constellation-2",
        "behavior:10000098:constellation:constellation-6",
        "behavior:10000098:talent:normalattack-normal",
        "behavior:10000098:talent:passives-passive-1",
        "behavior:10000098:talent:passives-passive-2",
        "behavior:10000098:talent:skill",
        "behavior:10000099:constellation:constellation-1",
        "behavior:10000099:constellation:constellation-2",
        "behavior:10000099:constellation:constellation-3",